id,name,slug,url,description,emails,email,phone,address,contacts_raw,categories,socials,website,instagram,facebook,twitter,linkedin
0d8e2750-ff95-42d2-95a0-fcc452d5b88b,COM International Osteopathic Medical Organization,com_iomo,https://msu.campuslabs.com/engage/organization/com_iomo,"International Osteopathic Medicine Organization (IOMO), offers a global perspective to its members by supporting global health initiatives with the understanding that there are substantial health care disparities around the world. Our efforts are focused on awareness and action through research and international partnership. IOMO works with the Institute of Global Health at Michigan State University (MSU) to facilitate international medical travel opportunities for students at Michigan State University College of Osteopathic Medicine (MSUCOM). Members of IOMO benefit from speaker series, international travel, research grants, cultural competence events, and scholarships available to those with a demonstrated commitment to studying medical care to underserved populations abroad. Contact Information Address Contact Email E: iomo.msucom@gmail.com",iomo.msucom@gmail.com,iomo.msucom@gmail.com,,,,,"{""instagram"": ""https://www.instagram.com/msucom_iomo/?next=%2F"", ""facebook"": null, ""twitter"": null, ""linkedin"": null, ""website"": ""https://msu.campuslabs.com/engage/organization/com_iomo/contact""}",https://msu.campuslabs.com/engage/organization/com_iomo/contact,https://www.instagram.com/msucom_iomo/?next=%2F,,,
abb676e1-a47b-4d11-96f1-70f525ed6ec5,COM American Medical Women's Association,comamwa,https://msu.campuslabs.com/engage/organization/comamwa,"AMWA strives to advance women in medicine and improve women's health by providing and developing leadership, advocacy, education, expertise, mentoring, and strategic alliances. Contact Information Address Contact Email E: amwaatmsucom@gmail.com",amwaatmsucom@gmail.com,amwaatmsucom@gmail.com,,,,,"{""instagram"": ""https://www.instagram.com/amwa_msucom/?hl=en"", ""facebook"": null, ""twitter"": null, ""linkedin"": null, ""website"": ""https://www.amwa-doc.org/""}",https://www.amwa-doc.org/,https://www.instagram.com/amwa_msucom/?hl=en,,,
bac12a1e-faff-438c-873a-ef9efd5f2e4a,COM Class of 2026,comclass2026,https://msu.campuslabs.com/engage/organization/comclass2026,"This organization is the Michigan State University College of Osteopathic Medicine Class of 2026 or commonly referred to as COM Class of 2026 organization. It is meant to further the educational and professional endeavors of future osteopathic physicians. This organization strives to unite the student body and the administration toward common educational, professional, and social goals; unify the Detroit Medical Center (DMC), East Lansing (EL), and Macomb University Center (MUC) as three campuses, one college and one voice; improve and promote the art and science of Osteopathic Medicine; uphold the high standards of integrity within the profession of Osteopathic Medicine; and preserve the tenets of academic honesty and professional decorum among members of the Class of 2026. Contact Information Address 965 Wilson Road Room C101 - East Fee Hall East Lansing, MI 48824 United States of America Contact Email E: rso.com-classgov2026@msu.edu Phone Number P: 5173554608",rso.com-classgov2026@msu.edu,rso.com-classgov2026@msu.edu,5173554608,,,,"{""instagram"": ""https://www.instagram.com/msucom2026/"", ""facebook"": null, ""twitter"": null, ""linkedin"": null, ""website"": ""https://msu.campuslabs.com/engage/organization/comclass2026/contact""}",https://msu.campuslabs.com/engage/organization/comclass2026/contact,https://www.instagram.com/msucom2026/,,,
60161893-af4c-46fd-9815-f79a04c3221f,Comfy Cozys for Chemo,comfycozys,https://msu.campuslabs.com/engage/organization/comfycozys,"MSU organization furthering the fantastic work of Comfy Cozys for Chemo. We will be fundraising, advocating, and event planning to support child cancer. Comfy Cozys for Chemo aims to create care packages, including Comfy Cozy's for Chemo adaptive apparel that has zippers, buttons, snaps, pockets, and openings to allow nurses to access the child’s port while allowing them to remain covered, and hand-delivering them to children at local hospitals. Contact Information Address 6104 Thistlewood Ave Scotts, MI 49088 United States Contact Email E: comfycozymsu@gmail.com Phone Number P: 2699936974 x+1",comfycozymsu@gmail.com,comfycozymsu@gmail.com,2699936974,,,,"{""instagram"": ""https://instagram.com/comfycozymsu?utm_medium=copy_link"", ""facebook"": ""https://www.facebook.com/comfycozymsu"", ""twitter"": null, ""linkedin"": null, ""website"": ""https://www.amandahope.org/comfycozy""}",https://www.amandahope.org/comfycozy,https://instagram.com/comfycozymsu?utm_medium=copy_link,https://www.facebook.com/comfycozymsu,,
870aad59-838b-482b-a59e-f9329a3141b7,COM Internal Medicine Club,comimc,https://msu.campuslabs.com/engage/organization/comimc,"IMC is dedicated to educating students about the vast possibilities in the field of Internal Medicine. Our organization aims to aid and encourage members' personal quests to become excellent physicians, regardless of their chosen discipline Contact Information Address Contact Email E: msucom.imc@gmail.com",msucom.imc@gmail.com,msucom.imc@gmail.com,2024-2025,,,,"{""instagram"": ""https://www.instagram.com/msucom_imc/?hl=en"", ""facebook"": ""https://www.facebook.com/groups/msucomimc/"", ""twitter"": null, ""linkedin"": null, ""website"": ""https://www.campusreel.org/colleges/michigan-state-university-college-of-osteopathic-medicine/videos/internal-medicine-club-org-fair-introduction""}",https://www.campusreel.org/colleges/michigan-state-university-college-of-osteopathic-medicine/videos/internal-medicine-club-org-fair-introduction,https://www.instagram.com/msucom_imc/?hl=en,https://www.facebook.com/groups/msucomimc/,,
d121f2cd-49d6-4970-ba8f-532141ce3a93,"COM Lesbian, Gay, Bisexual, Transgender, & Allies in Medicine",comlgbta,https://msu.campuslabs.com/engage/organization/comlgbta,"LGBT & Allies in Medicine at MSUCOM advocates for equality and acknowledging diversity in the medical community. To achieve this equality and recognition we wil l educate ourselves and our colleagues in LGBTQ+ issues as they relate to everyday life and the practice of medicine using expertise from the LGBTQ+ community and campus resources. Our goal is to assist in the development of competent physicians willing to serve and treat all people to the best of their ability. We welcome intersectionality, inclusivity and diversity for all to share and converse. Our club's mission is to educate and spread awareness about LGBT+ issues and disparities in medicine. Allies and those of the LGBT+ community are part of this mission. Contact Information Address Contact Email E: lgbtamedcom@gmail.com",lgbtamedcom@gmail.com,lgbtamedcom@gmail.com,,,,,"{""instagram"": ""https://www.instagram.com/lgbtamsucom/"", ""facebook"": ""https://www.facebook.com/lgbtamedcom/"", ""twitter"": null, ""linkedin"": null, ""website"": ""https://msu.campuslabs.com/engage/organization/comlgbta/contact""}",https://msu.campuslabs.com/engage/organization/comlgbta/contact,https://www.instagram.com/lgbtamsucom/,https://www.facebook.com/lgbtamedcom/,,
3e08ed12-c685-40a0-bdb8-95824f3c4051,Community Hearts,communityhearts,https://msu.campuslabs.com/engage/organization/communityhearts,"Community Hearts recognizes the life-saving benefits of correctly instructed CPR and seeks to enhance the health preparedness of the local community. We aim to provide our peers an opportunity to practice leadership and teaching skills while providing life-saving education and developing interprofessional relationships. We believe that everyone should have access to CPR skills; thus, our mission is to bring efficacious CPR courses at minimal cost to members of the Michigan State University community and beyond. To complete this mission, we work with the MSU Learning Assessment Center to provide health school students the opportunity to work together to teach CPR classes to the community on a volunteer basis and even become certified CPR instructors!",,,,,,,"{""instagram"": null, ""facebook"": null, ""twitter"": null, ""linkedin"": null, ""website"": ""https://msu.campuslabs.com/engage/organization/communityhearts/contact""}",https://msu.campuslabs.com/engage/organization/communityhearts/contact,,,,
e97c72b4-cd2d-4e69-82ec-43549e0b981d,COM Peer Mentors,compm,https://msu.campuslabs.com/engage/organization/compm,"Contact Information Address 965 Wilson Road Room C101 East Lansing, MI 48824 USA Contact Email E: peermentors.msucom@gmail.com Phone Number P: 248-826-4457",peermentors.msucom@gmail.com,peermentors.msucom@gmail.com,248-826-4457,,,,"{""instagram"": ""https://www.instagram.com/msucom_pm?utm_source=ig_web_button_share_sheet&igsh=ZDNlZDc0MzIxNw=="", ""facebook"": null, ""twitter"": null, ""linkedin"": null, ""website"": ""https://michiganstate.sharepoint.com/sites/OnTargetforAcademicSuccess/SitePages/Peer-Mentors.aspx?source=https%3a//michiganstate.sharepoint.com/sites/OnTargetforAcademicSuccess/SitePages/Forms/ByAuthor.aspx""}",https://michiganstate.sharepoint.com/sites/OnTargetforAcademicSuccess/SitePages/Peer-Mentors.aspx?source=https%3a//michiganstate.sharepoint.com/sites/OnTargetforAcademicSuccess/SitePages/Forms/ByAuthor.aspx,https://www.instagram.com/msucom_pm?utm_source=ig_web_button_share_sheet&igsh=ZDNlZDc0MzIxNw==,,,
a4925368-2e4b-4431-bb3d-5761f43e183e,COM PA Medicine Student Society,compmss,https://msu.campuslabs.com/engage/organization/compmss,"PAMSS is the official student organization for all current PA students within MSUCOM. We provide peer-peer mentoring, opportunities for volunteering, as well as educational and hands-on learning events. Our main goals are to promote the health and well-being of the surrounding community and the physician assistant profession. Contact Information Address 909 Wilson Road East Lansing, MI 48824 United States Contact Email E: PA.medSS@msu.edu",PA.medSS@msu.edu,PA.medSS@msu.edu,,,,,"{""instagram"": ""https://www.instagram.com/michiganstatepa/"", ""facebook"": null, ""twitter"": null, ""linkedin"": null, ""website"": ""https://com.msu.edu/future-students/pa-medicine-program""}",https://com.msu.edu/future-students/pa-medicine-program,https://www.instagram.com/michiganstatepa/,,,
6fc10438-411c-4b80-ac9e-ce23975ce2e4,Council of Medical Students,coms,https://msu.campuslabs.com/engage/organization/coms,"To promote the academic, social, and economic aims of medical students at Michigan State University. To establish effective communication among medical students and between medical schools; and to create channels of communication that lead to successful collaborations for the improvement of oneself with other student organizations. To initiate communication and promote cooperation with the academic and administrative departments of the three medical schools (including off-campus) and the University. Contact Information Address Contact Email E: msu.council.of.med.students@gmail.com",msu.council.of.med.students@gmail.com,msu.council.of.med.students@gmail.com,,,,,"{""instagram"": null, ""facebook"": null, ""twitter"": null, ""linkedin"": null, ""website"": ""https://msu.campuslabs.com/engage/organization/coms/contact""}",https://msu.campuslabs.com/engage/organization/coms/contact,,,,
73753af3-3918-4436-b55f-d8223cc800a9,COM Sigma Sigma Phi,comsigmasigmaphi,https://msu.campuslabs.com/engage/organization/comsigmasigmaphi,"The Iota Chapter of Sigma Sigma Phi is the MSU College of Osteopathic Medicine chapter of the National Honorary Osteopathic Service Fraternity. Our mission is to further the science of osteopathic medicine, improve scholastic standing among students, and foster relationships between students, faculty, and the AOA. Every year, first year MSUCOM students are invited to join SSP. A maximum of 25% of COM’s students may be selected for induction. Members have countless opportunities to be involved in the community through volunteering, get national recognition on residency applications, and become leaders at MSUCOM and in the osteopathic profession. Contact Information Address 965 Wilson Rd East Lansing, MI 48824 United States Contact Email E: msucom.ssp@gmail.com Phone Number P: 517-355-9616 Fax Number F: 517-432-2125",msucom.ssp@gmail.com,msucom.ssp@gmail.com,517-355-9616,,,,"{""instagram"": ""https://www.instagram.com/msucom_ssp/"", ""facebook"": null, ""twitter"": null, ""linkedin"": null, ""website"": ""http://www.com.msu.edu/Student_Groups/Flyers-2010/SSP.pdf""}",http://www.com.msu.edu/Student_Groups/Flyers-2010/SSP.pdf,https://www.instagram.com/msucom_ssp/,,,
def55e81-6833-4513-80d0-2570ceb7afbe,Concert Orchestra Student Association,cosa,https://msu.campuslabs.com/engage/organization/cosa,"COSA is for members of the MSU Concert Orchestra who have a desire to become more involved in the program's logistics. These operations can include advertising, community engagement, social media, recruitment, fundraising, events, etc. Contact Information Address 333 W Circle Dr Room 121 East Lansing, MI 48823 United States Contact Email E: rso.cosa@msu.edu",rso.cosa@msu.edu,rso.cosa@msu.edu,,,,,"{""instagram"": ""https://instagram.com/concertorchestramsu"", ""facebook"": ""https://www.facebook.com/MSUConcertOrchestra"", ""twitter"": null, ""linkedin"": null, ""website"": ""https://orch.music.msu.edu""}",https://orch.music.msu.edu,https://instagram.com/concertorchestramsu,https://www.facebook.com/MSUConcertOrchestra,,
fb57fd5d-3dc9-417a-b128-f59ede49bf61,Cozy CoverZzz,cozycoverzzz,https://msu.campuslabs.com/engage/organization/cozycoverzzz,Contact Information Address United States Contact Email E: cozycoverzz@gmail.com,cozycoverzz@gmail.com,cozycoverzz@gmail.com,,,,,"{""instagram"": ""https://www.instagram.com/cozycoverzzz_msu/"", ""facebook"": ""https://www.facebook.com/groups/293632774363334/"", ""twitter"": null, ""linkedin"": null, ""website"": ""https://msu.campuslabs.com/engage/organization/cozycoverzzz/contact""}",https://msu.campuslabs.com/engage/organization/cozycoverzzz/contact,https://www.instagram.com/cozycoverzzz_msu/,https://www.facebook.com/groups/293632774363334/,,
21f6c1b0-72f9-425d-8869-72fb796291db,Corporate Retail Association,cra,https://msu.campuslabs.com/engage/organization/cra,Contact Information Address Contact Email E: msucorporateretail@gmail.com,msucorporateretail@gmail.com,msucorporateretail@gmail.com,,,,,"{""instagram"": ""https://www.instagram.com/msucra/"", ""facebook"": null, ""twitter"": null, ""linkedin"": ""https://www.linkedin.com/groups/6991154/"", ""website"": ""http://www.msucra.com""}",http://www.msucra.com,https://www.instagram.com/msucra/,,,https://www.linkedin.com/groups/6991154/
08da2cd2-e7cd-4119-a6f2-2b52c8eaceaf,"Crew Club, MSU",crew,https://msu.campuslabs.com/engage/organization/crew,"The Michigan State University Crew Club is a student-run rowing organization that welcomes athletes of all experience levels, from complete beginners to seasoned rowers. Established in 1956, the club has a long history and a strong sense of community among its members. Practices are held Monday through Saturday, with weekday sessions from 6:00 to 8:00 PM and Saturday sessions from 10:00 AM to 12:00 PM. Depending on the season and weather conditions, practices take place either at the MSU Crew Club Boat House on the Grand River or at Demonstration Hall. The club emphasizes inclusivity, welcoming individuals of all backgrounds and fitness levels. No prior rowing experience is required, as experienced coaches provide training to help novices learn the fundamentals of the sport. Beyond rowing, the MSU Crew Club fosters a culture of camaraderie and personal growth, strengthened by the continued support of its alumni network. The club recently celebrated its 70th anniversary, highlighting its longstanding presence and impact within the MSU community. Contact Information Address 308 W. Circle Dr, Rm. 121 East Lansing, MI 48824 United States Contact Email E: msucrew@msu.edu",msucrew@msu.edu,msucrew@msu.edu,02--2025,,,,"{""instagram"": ""https://instagram.com/msu_crew?igshid=1pm23lp9y8yu6"", ""facebook"": ""https://www.facebook.com/MichiganStateUniversityCrewClub/"", ""twitter"": null, ""linkedin"": null, ""website"": ""https://www.msucrewclub.org""}",https://www.msucrewclub.org,https://instagram.com/msu_crew?igshid=1pm23lp9y8yu6,https://www.facebook.com/MichiganStateUniversityCrewClub/,,
2f5c6212-f2f3-4402-80c1-802ab9e102a0,Criminal Justice Society,criminaldefenseassociation,https://msu.campuslabs.com/engage/organization/criminaldefenseassociation,"The Criminal Justice Society (CJS) is a student organization at the Michigan State University (MSU) College of Law (COL) created to pursue, but is not limited to, the following aims: (a) foster a nurturing community of students passionate about criminal law, whether those passions lie in prosecutorial or defense-oriented careers; (b) promote a respectful environment where students may freely discuss the criminal justice system; (c) educate students about the opportunities, advantages, inadequacies, and realities of various careers in criminal law; (d) teach students the skills necessary to succeed as criminal justice advocates; (e) generate a long-term community of MSU COL alumni committed to careers in criminal law; and (f) help integrate current students and alumni into a network of employers who are looking to hire advocates by way of speaker events, collaborations with other MSU COL and criminal justice adjacent organizations, and the like. Contact Information Address 648 N Shaw Ln East Lansing, MI 48824 United States Contact Email E: butle319@msu.edu Phone Number P: 8503769282",butle319@msu.edu,butle319@msu.edu,8503769282,,,,"{""instagram"": null, ""facebook"": null, ""twitter"": null, ""linkedin"": null, ""website"": ""https://msu.campuslabs.com/engage/organization/criminaldefenseassociation/contact""}",https://msu.campuslabs.com/engage/organization/criminaldefenseassociation/contact,,,,
2b59cebd-7fd4-4e31-a8f1-13ad78cf39c5,Criminal Psychology,criminalpysch,https://msu.campuslabs.com/engage/organization/criminalpysch,"Together as a group we will be picking a case/offender bi-weekly and studying their behaviors, thoughts, intentions, etc. With our information we will meet bi-weekly to discuss our theories on why this offender did what they did and what led them to this. We will evaluate on our own the actions that may of led this person to commit this crime with attempts to profile them. This is a way for students to study criminal profiling, psychology, law, justice, etc. Along with using a clinical approach to profile the offender we can also share our opinions on the trial, risk of re-offending, and law enforcement involved in the case. Contact Information Address 1151 E Michigan Ave. East Lansing , MI 48823 United States Contact Email E: wildfon4@msu.edu Phone Number P: 9894302881",wildfon4@msu.edu,wildfon4@msu.edu,9894302881,,,,"{""instagram"": ""https://www.instagram.com/msucriminalpsych/"", ""facebook"": null, ""twitter"": null, ""linkedin"": null, ""website"": ""https://msu-criminal-pyschology-club.business.site/?m=true""}",https://msu-criminal-pyschology-club.business.site/?m=true,https://www.instagram.com/msucriminalpsych/,,,
79c682d5-3366-4923-9299-8dfd688412ca,Cru,cruatstate,https://msu.campuslabs.com/engage/organization/cruatstate,"Cru is a student-led community passionate about connecting people to Jesus Christ. We host Small Groups all over campus every week and have a weekly meeting known as Real Life. You can learn more about who Cru is below. Get Connected at cruatstate.com Cru is a student-led community passionate about connecting people to Jesus Christ. College is an opportunity in most students’ lives to learn who they are and what they value most. In these years many students experience new things in search of their identity and purpose in life. Cru is a caring group of students who want to listen and learn from one another about what each journey has looked like, and what is being discovered along the way. Cru believes the most important part of this journey is discovering and growing in a relationship with God. We believe we are broken, sinful individuals separated from a holy loving God, but that God sent Jesus as the only way to restore relationship to Him. Believing in Jesus’ life, death, and resurrection allows us to know God personally. We seek to be a community that supports and nurtures others as they explore and pursue their faith. There are inevitable points of confusion where people may question what they thought was true both of the world around them and of themselves individually. Many are not looking for someone to solve all of their problems, but someone who will listen and let them know they are not crazy for having questions. Cru desires to be a community that journeys with you and your relationship with God, sharing experiences of Biblical grace and truth with you that will last a lifetime. Not only this, but we believe God put you where you are for a reason and he has a plan for your life that will impact others at MSU and beyond. It is our hope that as you grow in a Christ-centered community, you will be better equipped and prepared for life after college. We are Michigan State students helping students know Jesus, care for each other, and grow in their faith. Contact Information Address Contact Email E: cruatstate@gmail.com",cruatstate@gmail.com,cruatstate@gmail.com,,,,,"{""instagram"": ""http://www.instagram.com/cruatstate/"", ""facebook"": ""http://www.facebook.com/cruatstate/"", ""twitter"": null, ""linkedin"": null, ""website"": ""https://www.cruatstate.com/""}",https://www.cruatstate.com/,http://www.instagram.com/cruatstate/,http://www.facebook.com/cruatstate/,,
83f207d4-7c11-4f82-b886-dcdac4fabcf7,Chinese-American Student Coalition,csc,https://msu.campuslabs.com/engage/organization/csc,"The purpose of the Chinese-American Student Coalition is to foster an environment that supports Chinese-American students and those interested in Chinese culture, providing a space that bridges the divide between Chinese and American identities. We host a multitude of events including our Rice Night, Mid-Autumn Festival (including lantern painting and moon cakes), annual Lunar New Year banquet celebration, and more! For those interested in attending events, please follow our Instagram @msucsc for the most up-to-date announcements. Contact Information Address Contact Email E: cscmsu@gmail.com",cscmsu@gmail.com,cscmsu@gmail.com,,,,,"{""instagram"": ""https://msu.campuslabs.comwww.instagram.com/msucsc/"", ""facebook"": ""https://www.facebook.com/msucsc19/"", ""twitter"": ""http://cscmsu.wix.com/csc"", ""linkedin"": null, ""website"": ""https://www.youtube.com/@msucsc5810""}",https://www.youtube.com/@msucsc5810,https://msu.campuslabs.comwww.instagram.com/msucsc/,https://www.facebook.com/msucsc19/,http://cscmsu.wix.com/csc,
f1616cc4-80b6-4a89-ba13-888e570178ff,"Counter-Strike Club, Michigan State University",csclub,https://msu.campuslabs.com/engage/organization/csclub,"The Counter-Strike Club brings together the Spartans who share a passion for FPS gaming, tactical teamwork, and community building through the legendary Counter-Strike franchise. Whether you're a seasoned veteran grinding FACEIT levels or a newcomer, our club offers a welcoming environment for players of all skill levels. We are proudly affiliated with ECA, the Esports Association here at Michigan State. The best way to be notified of our events and staying in contact with us is by joining our discord. We hope to meet you there! Don't be shy XD Discord: https://discord.gg/vC2B3F4 Contact Information Address 3109 Trappers Cove Trail Apt 1C Lansing, MI 48910 US Contact Email E: mousavis@msu.edu Phone Number P: 5175287562",mousavis@msu.edu,mousavis@msu.edu,5175287562,,,,"{""instagram"": null, ""facebook"": null, ""twitter"": ""https://twitter.com/MichiganStateCS"", ""linkedin"": null, ""website"": ""https://discord.gg/vC2B3F4""}",https://discord.gg/vC2B3F4,,,https://twitter.com/MichiganStateCS,
4487af01-d908-4ef0-b450-be0a21b307f8,Council of Students with Disabilities,csd,https://msu.campuslabs.com/engage/organization/csd,"CSD is an organization for undergraduate students with disabilities and their supporters in the MSU community who want to focus on awareness, advocacy, support and removing barriers to full participation on MSU's campus. All programs and activities are open to all without restriction or preference based on race, sex, color, ethnicity, national origin or other protected personal identity. Check out similar incredible organizations for our disabled graduate student population! - Graduate Student Accessibility & Support Network - Spartan Alliance for Disability Inclusion and Equity Contact Information Address 434 Farm Lane, #120 Bessey Hall East Lansing, MI 48824 US Contact Email E: walkerv4@msu.edu; floydcol@msu.edu Phone Number P: 517-884-1908 Fax Number F: 517-432-3191",floydcol@msu.edu; walkerv4@msu.edu,floydcol@msu.edu,517-884-1908,,,,"{""instagram"": ""https://www.instagram.com/msucsd"", ""facebook"": null, ""twitter"": null, ""linkedin"": null, ""website"": ""https://msu.campuslabs.com/engage/organization/gsasn""}",https://msu.campuslabs.com/engage/organization/gsasn,https://www.instagram.com/msucsd,,,
