id,name,slug,url,description,emails,email,phone,address,contacts_raw,categories,socials,website,instagram,facebook,twitter,linkedin
7598e39a-c5dd-4316-90c0-ace7e311d952,021,021,https://msu.campuslabs.com/engage/organization/021,"A group of passionate builders who spend their nights and weekends building cool stuff. + we have pizza. Contact Information Address 308 E Michigan Ave Apt 108 East Lansing, MI 48823 United States Contact Email E: 021.msu.builders@gmail.com Phone Number P: 7138944935",021.msu.builders@gmail.com,021.msu.builders@gmail.com,7138944935,,,,"{""instagram"": null, ""facebook"": null, ""twitter"": null, ""linkedin"": null, ""website"": ""https://021.builders/""}",https://021.builders/,,,,
e647fbfa-74a5-4ec3-80ac-7688e4172e6d,180 Degrees Consulting MSU,180,https://msu.campuslabs.com/engage/organization/180,180 Degrees Consulting is the world's largest consultancy for non-profits & social enterprises. We provide high-quality consulting services to social impact organizations so they can improve and expand their services. Contact Information Address Contact Email E: msu@180dc.org,msu@180dc.org,msu@180dc.org,,,,,"{""instagram"": ""https://www.instagram.com/msu180dc/"", ""facebook"": null, ""twitter"": null, ""linkedin"": ""https://www.linkedin.com/company/180-degrees-consulting-michigan-state-university/"", ""website"": ""https://180dcmichstate.com""}",https://180dcmichstate.com,https://www.instagram.com/msu180dc/,,,https://www.linkedin.com/company/180-degrees-consulting-michigan-state-university/
f96d197b-6d8f-4128-9db1-bdcd06196ebf,For Michigan,4michmsu,https://msu.campuslabs.com/engage/organization/4michmsu,Contact Information Address Contact Email E: edward@4mich.org,edward@4mich.org,edward@4mich.org,,,,,"{""instagram"": null, ""facebook"": null, ""twitter"": ""https://twitter.com/@4mich024"", ""linkedin"": null, ""website"": ""http://www.4mich.org/Michigan-State-University""}",http://www.4mich.org/Michigan-State-University,,,https://twitter.com/@4mich024,
8b3b8588-a09d-4504-acd9-41df7b039782,Black Celebratory,aac,https://msu.campuslabs.com/engage/organization/aac,"A young group of African American students led by Michael Oden decided it was time to recognize and celebrate the achievements of other black students on campus. With the support of the Black Student Alliance, as well as black faculty and staff, they founded the Black Celebratory formerly known as African American Celebratory. Black Celebratory is known for hosting the traditional cultural event of Black Graduation on Michigan State University's campus. Black Celebratory received both local and national support for acknowledging the accomplishments of black students in its first active year. However, with support came criticism. Nevertheless, the organization continues to productively celebrate the graduation of black students. Over the years, the goals of the MSUBC have expanded to include community outreach and service learning engagement. Black Graduation is a ceremony focused around Michigan State University’s Black student’s accomplishment of successfully completing an undergraduate, graduate, or doctoral degree from Michigan State University. Black Graduation represents the culture of our students, support of our communities, and excellence in scholarship. A cultural rite of passage that acknowledges all prospective graduates and in no way is a replacement ceremony to Michigan State’s yearly commencement. While sharing in the values of scholarship, community, integrity, and black excellence in all student experiences; Black Grad concludes each ceremony with a Kente-Stole accolade dedicated to the current class of graduates from Michigan State University Contact Information Address Contact Email E: rso.aac@msu.edu",rso.aac@msu.edu,rso.aac@msu.edu,,,,,"{""instagram"": ""https://www.instagram.com/msu_bc/"", ""facebook"": null, ""twitter"": null, ""linkedin"": ""https://www.linkedin.com/in/black-celebratory-87ab27295/"", ""website"": ""https://msublackcelebratory.weebly.com/about.html""}",https://msublackcelebratory.weebly.com/about.html,https://www.instagram.com/msu_bc/,,,https://www.linkedin.com/in/black-celebratory-87ab27295/
6c37b2a0-c486-4367-b779-5f07296294b9,"American Advertising Federation, MSU Chapter",aafmsu,https://msu.campuslabs.com/engage/organization/aafmsu,"Every year, we receive a new corporate client, and the ultimate goal is always to create a multimedia advertising campaign. This includes research, strategy, and executions. Ultimately we compile all our work into a plansbook, and pitch our campaign to a panel of judges, including a representative of the client. We operate as similarly to a real ad agency as possible. Participants may receive credit for either ADV 386 or ADV 486. Contact Information Address Contact Email E: aafmsu@gmail.com",aafmsu@gmail.com,aafmsu@gmail.com,,,,,"{""instagram"": ""https://www.instagram.com/msuaaf/"", ""facebook"": ""https://www.facebook.com/MSUAAFCedarBanks"", ""twitter"": null, ""linkedin"": ""https://www.linkedin.com/company/msuaaf-cedar-banks/mycompany/"", ""website"": ""https://aafmsu.wixsite.com/cedarbanks""}",https://aafmsu.wixsite.com/cedarbanks,https://www.instagram.com/msuaaf/,https://www.facebook.com/MSUAAFCedarBanks,,https://www.linkedin.com/company/msuaaf-cedar-banks/mycompany/
e94950f9-6cb4-4a9c-a4da-79016155fe0d,Aviation and Aerospace Medicine Interest Group,aaig,https://msu.campuslabs.com/engage/organization/aaig,"The Aviation and Aerospace Medicine Interest Group (AAMIG) at Michigan State University College of Human Medicine is a student-led organization dedicated to exploring the unique physiological and clinical challenges faced in aviation and space environments. As part of the Midwest Chapter of the Aerospace Medicine Student and Resident Organization (AMSRO), AAMIG aims to build awareness of aerospace medicine through speaker events, educational opportunities, and local community engagement. Our events so far have included a virtual discussion with a practicing flight surgeon and a volunteer initiative with Wings of Mercy, a nonprofit that provides free air transportation to patients in need. We welcome students of all backgrounds who are curious about the intersection of medicine, aviation, and human performance in extreme environments. Contact Information Address Contact Email E: shahabby@msu.edu",shahabby@msu.edu,shahabby@msu.edu,,,,,"{""instagram"": null, ""facebook"": null, ""twitter"": null, ""linkedin"": null, ""website"": ""https://msu.campuslabs.com/engage/organization/aaig/contact""}",https://msu.campuslabs.com/engage/organization/aaig/contact,,,,
a2aa4371-0cd2-4c59-a14b-85f85136be27,Albanian American Student Organization,aasomsu,https://msu.campuslabs.com/engage/organization/aasomsu,"AASO is open to any MSU student who expresses an interest in learning more about the Albanian culture and its purpose. AASO engages through a mix of cultural, social, fundraising, and educational events. This organization will not discriminate on the basis of age, color, gender, gender identity, disability status, height, marital status, national origin, political persuasion, race, religion, sexual orientation, veteran status, or weight. Only MSU students may be officers and/or voting members. Contact Information Address Contact Email E: aaso.spartans@gmail.com",aaso.spartans@gmail.com,aaso.spartans@gmail.com,2022-2023,,,,"{""instagram"": ""https://www.instagram.com/aaso.michstate/"", ""facebook"": null, ""twitter"": null, ""linkedin"": null, ""website"": ""https://msu.campuslabs.com/engage/organization/aasomsu/contact""}",https://msu.campuslabs.com/engage/organization/aasomsu/contact,https://www.instagram.com/aaso.michstate/,,,
2e3009c9-cce6-4ed8-bd54-f83b2871db04,Abide Trinity College-age Ministry,abide,https://msu.campuslabs.com/engage/organization/abide,"A Christ-centered college-age ministry seeking to create space for college-age individuals to belong; connect with God, and with each other. Contact Information Address 3355 Dunckel Rd Lansing, MI 48911 United States of America Contact Email E: emmanuel.boateng@wearetrinity.com Phone Number P: 5172723820",emmanuel.boateng@wearetrinity.com,emmanuel.boateng@wearetrinity.com,5172723820,,,,"{""instagram"": null, ""facebook"": null, ""twitter"": null, ""linkedin"": null, ""website"": ""https://www.wearetrinity.com/abide/""}",https://www.wearetrinity.com/abide/,,,,
b438671d-7870-44a6-875e-9599e7eedb75,Association of Black Social Workers,absws,https://msu.campuslabs.com/engage/organization/absws,Association of Black Social Workers at Michigan State University is a Social work interest based group working towards developing an environment for Black Social work students BSW & MSW level on Michigan State University campus. Contact Information Address Contact Email E: absweboard@gmail.com,absweboard@gmail.com,absweboard@gmail.com,,,,,"{""instagram"": null, ""facebook"": null, ""twitter"": null, ""linkedin"": null, ""website"": ""https://msu.campuslabs.com/engage/organization/absws/contact""}",https://msu.campuslabs.com/engage/organization/absws/contact,,,,
78cfa7cd-1656-4051-91bb-8e9189c609cd,Aspiring Black Women Doctors,abwd,https://msu.campuslabs.com/engage/organization/abwd,"Bringing African American women together on MSU'S campus to discuss the experiences of being a black woman in the medical field. We aim to work together to prepare for medical school by developing programs and events geared towards this. As well as to advocate for the education and advancement of women in the medical field. Contact Information Address 3165 E Michigan Ave Unit 844D Lansing, MI 48912 United States Contact Email E: blakenad@msu.edu Phone Number P: 7342927291",blakenad@msu.edu,blakenad@msu.edu,7342927291,,,,"{""instagram"": null, ""facebook"": ""https://www.facebook.com/Aspiring-Black-Women-Doct"", ""twitter"": null, ""linkedin"": null, ""website"": ""https://aspiringblackwomen.wixsite.com/website""}",https://aspiringblackwomen.wixsite.com/website,,https://www.facebook.com/Aspiring-Black-Women-Doct,,
bf3094ed-24bb-4a82-9f0e-772a759e920b,Accessibility Professionals at MSU,accessibilityprofessionalsatmsu,https://msu.campuslabs.com/engage/organization/accessibilityprofessionalsatmsu,"Accessibility entails striving for equal access regardless of ability or disability. Accessibility Professionals at MSU will foster students' interest in the field of accessibility by encouraging professional connections, job opportunities and learning more about the industry. Contact Information Address 450 Auditorium Rd East Lansing, MI 48824 USA Contact Email E: rso.ap@msu.edu Phone Number P: 248-697-7219",rso.ap@msu.edu,rso.ap@msu.edu,248-697-7219,,,,"{""instagram"": ""https://www.instagram.com/accessibilityprofsofmsu/?igsh=MXBxMGN2Y3Frc3Rtdw%3D%3D"", ""facebook"": null, ""twitter"": null, ""linkedin"": null, ""website"": ""https://msu.campuslabs.com/engage/organization/accessibilityprofessionalsatmsu/contact""}",https://msu.campuslabs.com/engage/organization/accessibilityprofessionalsatmsu/contact,https://www.instagram.com/accessibilityprofsofmsu/?igsh=MXBxMGN2Y3Frc3Rtdw%3D%3D,,,
6ecff899-ae87-425c-b2b3-805c2f3f35ab,Adventist Christian Fellowship,acf,https://msu.campuslabs.com/engage/organization/acf,"The Adventist Christian Fellowship (ACF) is the official organization for Adventist campus ministry on non-Adventist college and university campuses within the North American Division (NAD) of Seventh-day Adventist’s, including the US, Canada, Bermuda and Guam. It is a ministry of students, by students and for students, supported by local Adventist churches and resourced by Adventist Conferences, Unions and the North American Division. Our goal here at ACF - MSU is to lead young people into a saving relationship with Jesus Christ, and help them embrace His call to discipleship. The mission of the Adventist Youth Fellowship organization can be combined into these four objectives: To equip and inspire young people to be Christian ambassadors to their respective places of work and study through Biblical training, Christian fellowship, network opportunities, and leadership responsibilities To mobilize existing youth and young adult ministries that are fully committed to the distinctive message and mission of the Adventist Church towards the proclamation of the Three Angels’ Messages To provide a support system for Adventist students studying on non-Adventist universities To establish university churches (Uchurches) that see reaching the public campus as one of their primary ministry responsibilities, and integrate public campus ministry into the ministry of the local church. The ACF group at Michigan State University strives to carry out this mission through weekly Bible studies, prayer groups, outreach programs, networking opportunities, and numerous social events hosted on and off the Michigan State University campus. Our organization also frequently partners with CAMPUS (Center for Adventist Ministry to Public University Students) which is a department that focuses solely on ministry on secular university and college campuses. Contact Information Address 504 Ann St East Lansing, MI 48823 United States Contact Email E: brooksne@msu.edu Phone Number P: 5173772294",brooksne@msu.edu,brooksne@msu.edu,5173772294,,,,"{""instagram"": ""https://www.instagram.com/msuacf/"", ""facebook"": ""https://www.facebook.com/ACFNAD/"", ""twitter"": null, ""linkedin"": null, ""website"": ""https://acflink.org/""}",https://acflink.org/,https://www.instagram.com/msuacf/,https://www.facebook.com/ACFNAD/,,
1a764c45-8d70-4e00-8444-82dbaffcf870,Asian Christian InterVarsity,aciv,https://msu.campuslabs.com/engage/organization/aciv,"Asian Christian InterVarsity is a single chapter of the national ministry INTERVARSITY. At Michigan State, INTERVARSITY has four chapters: Asian Christian InterVarsity, Collegiate Black and Christian InterVarsity Christian Fellowship, Mosaic Intervarsity Christian Fellowship, and Latin American Campus Ministry. At ACIV, we hold weekly small group bible studies. Our bible studies and discussions are targeted for both new and experienced believers. Our goal is to create a community that: celebrates our Asian background, opens the word of the God to our lives and discussion, and creates relationships that extend beyond the organization. We also get a lot of bubble tea. Contact Information Address Contact Email E: kristle.eggleston@intervarsity.org",kristle.eggleston@intervarsity.org,kristle.eggleston@intervarsity.org,,,,,"{""instagram"": ""http://instagram.com/msuaciv"", ""facebook"": ""https://www.facebook.com/groups/msuaciv/"", ""twitter"": null, ""linkedin"": null, ""website"": ""https://intervarsity.org/""}",https://intervarsity.org/,http://instagram.com/msuaciv,https://www.facebook.com/groups/msuaciv/,,
932d4aaa-4030-47e3-a3f8-9e1e62aec80d,American Criminal Justice Association - MSU Chapter,acja-msu,https://msu.campuslabs.com/engage/organization/acja-msu,"A pre-professional organization geared towards any and all students with an interest in the criminal justice system. The Objectives of this association shall be: 1: To Foster professionalism within the agencies of criminal justice. 2: To promote understanding and better communication between agencies of criminal justice. 3: To foster, through fraternal contact, greater understanding between institutions of higher education and professional agencies of criminal justice. 4: To aid and encourage the expansion of higher education and to provide a unified voice for students interested in criminal justice in all matters of professional concern to them. 5: To aid and encourage involvement of students of criminal justice in works of community service and outreach. 6: To fulfill these objectives, this association's functions shall incorporate both social and informational aspects. Contact Information Address East Lansing, MI United States Contact Email E: acjamsu@gmail.com",acjamsu@gmail.com,acjamsu@gmail.com,,,,community service and outreach.,"{""instagram"": ""http://www.instagram.com/acjamsu"", ""facebook"": null, ""twitter"": null, ""linkedin"": null, ""website"": ""https://msu.campuslabs.com/engage/organization/acja-msu/contact""}",https://msu.campuslabs.com/engage/organization/acja-msu/contact,http://www.instagram.com/acjamsu,,,
dcd7a97b-74f7-40b9-89fa-69c0ccea82db,American Civil Liberties Union MSU COL Chapter,aclu-msulaw,https://msu.campuslabs.com/engage/organization/aclu-msulaw,"Our purpose is to discuss, learn, and advance civil liberties on campus and off-campus. We host events on current social issues, encourage volunteer work in the community, and work with other MSU Law student organizations to raise awareness of civil liberties issues. Contact Information Address 648 N Shaw Ln East Lansing , MI 48824 United States of America Contact Email E: sharke27@msu.edu",sharke27@msu.edu,sharke27@msu.edu,,,,,"{""instagram"": null, ""facebook"": ""https://www.facebook.com/ACLUofMichigan"", ""twitter"": null, ""linkedin"": null, ""website"": ""http://www.aclu.org""}",http://www.aclu.org,,https://www.facebook.com/ACLUofMichigan,,
404573b8-316c-4f89-8383-2909fca40933,Association for Computing Machinery,acm,https://msu.campuslabs.com/engage/organization/acm,"Whether you're completely new to programming or simply can't wait to get out of college, we're here to aid you and your computer science goals. We host tech talks and workshops presented by companies all across the nation; some that have presented in the past include Google, Microsoft, Ford, Quicken Loans, Target, Mozilla, and many more. We have more plans to announce very soon, so please join the ACM Discord server to stay up to date! Contact Information Address Contact Email E: acm@cse.msu.edu",acm@cse.msu.edu,acm@cse.msu.edu,,,,,"{""instagram"": null, ""facebook"": null, ""twitter"": null, ""linkedin"": null, ""website"": ""https://discord.gg/fWKV2TF""}",https://discord.gg/fWKV2TF,,,,
8e21c995-e49d-4619-8793-f3691725110f,COM American College of Osteopathic Surgeons,acos,https://msu.campuslabs.com/engage/organization/acos,"A group at MSUCOM for promoting interest and exposure to surgical specialties for osteopathic medical students and providing opportunities for the community to engage with osteopathic medical students through surgical experiences like residency panels, guest speakers, and suture clinics. Contact Information Address Contact Email E: acos.msucom@gmail.com",acos.msucom@gmail.com,acos.msucom@gmail.com,,,,,"{""instagram"": ""https://www.instagram.com/acosmsucom/?igshid=py1gc6zpzw30"", ""facebook"": ""https://www.facebook.com/groups/200744270419590/"", ""twitter"": null, ""linkedin"": null, ""website"": ""https://www.youtube.com/channel/UCbIK4iE4lk7ajYGNwQ9izwQ""}",https://www.youtube.com/channel/UCbIK4iE4lk7ajYGNwQ9izwQ,https://www.instagram.com/acosmsucom/?igshid=py1gc6zpzw30,https://www.facebook.com/groups/200744270419590/,,
5abfe371-fde7-4896-b971-75165174980b,Arab Cultural Society,acs,https://msu.campuslabs.com/engage/organization/acs,The purpose of this organization is to create a welcoming environment for Arabs and those interested in the Arab culture here at Michigan State University. We will work with other student groups on campus we hope to collaborate with these groups to both sponsor gathering and educational events about the Arab culture. Contact Information Address Contact Email E: arabmsu1@gmail.com,arabmsu1@gmail.com,arabmsu1@gmail.com,,,,,"{""instagram"": ""https://www.instagram.com/msuacs/"", ""facebook"": ""https://www.facebook.com/acsmsu1/"", ""twitter"": null, ""linkedin"": null, ""website"": ""https://msu.campuslabs.com/engage/organization/acs/contact""}",https://msu.campuslabs.com/engage/organization/acs/contact,https://www.instagram.com/msuacs/,https://www.facebook.com/acsmsu1/,,
68e8c866-3610-4659-9515-76dd2ae5c3e7,Actuarial Science Club,actuarial,https://msu.campuslabs.com/engage/organization/actuarial,"Providing members with the ability to meet a variety of companies to learn about different actuary career tracks. Members have access to different networking, social, and professional resources to navigate the actuary profession and exams. Students of all age and actuary experience from zero to experts are welcome to ask questions and attend meetings! Contact Information Address Contact Email E: ActuarialScience@RSO.msu.edu or Acohen@msu.edu",Acohen@msu.edu; ActuarialScience@rso.msu.edu,Acohen@msu.edu,,,,,"{""instagram"": ""https://www.instagram.com/msu_actsci/"", ""facebook"": null, ""twitter"": null, ""linkedin"": null, ""website"": ""https://msu.campuslabs.com/engage/organization/actuarial/contact""}",https://msu.campuslabs.com/engage/organization/actuarial/contact,https://www.instagram.com/msu_actsci/,,,
851e5bbf-f7fb-475f-bf8c-cac2c8c1521c,Advanced Additive Manufacturing,adama,https://msu.campuslabs.com/engage/organization/adama,"The purpose of this organization is to bring together like minded individuals who share an interest in additive manufacturing of polymers and polymer composites. We encourage all levels of experience to consider joining and to share your past and future projects for everyone to learn from. The organization includes topics in material science and chemical engineering, as well as mechanical and electrical engineering. Individuals with other backgrounds in modeling or art are also encouraged to join. Contact Information Address 1250 Garden City Road apt 410 East Lansing, MI 48823 United States Contact Email E: delemee4@msu.edu Phone Number P: 9899483361",delemee4@msu.edu,delemee4@msu.edu,9899483361,,,,"{""instagram"": null, ""facebook"": null, ""twitter"": null, ""linkedin"": null, ""website"": ""https://msu.campuslabs.com/engage/organization/adama/contact""}",https://msu.campuslabs.com/engage/organization/adama/contact,,,,
1fb0a10f-4c38-4532-8377-6e1565440e43,Association for Doctoral Students in the Information and Media program,adsim,https://msu.campuslabs.com/engage/organization/adsim,"Contact Information Address 404 Wilson Road, CAS 249 EAST LANSING, MI 48824-6419 United States Contact Email E: rso.adsim@msu.edu Phone Number P: (517)3539907",rso.adsim@msu.edu,rso.adsim@msu.edu,48824-6419,,,,"{""instagram"": null, ""facebook"": ""https://www.facebook.com/groups/MSUIMPhD"", ""twitter"": null, ""linkedin"": null, ""website"": ""https://msu.campuslabs.com/engage/organization/adsim/contact""}",https://msu.campuslabs.com/engage/organization/adsim/contact,,https://www.facebook.com/groups/MSUIMPhD,,
891a7e43-c2c6-43c2-af95-d2f87916e5b2,Alpha Epsilon Delta: Pre-Professional Honor Society for Health Careers,aed,https://msu.campuslabs.com/engage/organization/aed,"Alpha Epsilon Delta is a national honor society for students interested in pre-health careers. We participate in serving the local Lansing community, provide networking opportunities, and career building. Contact Information Address Contact Email E: preproff@gmail.com",preproff@gmail.com,preproff@gmail.com,,,,,"{""instagram"": ""https://www.instagram.com/aedmsu/?hl=en"", ""facebook"": ""https://www.facebook.com/AlphaEpsilonDeltaMichiganState/"", ""twitter"": null, ""linkedin"": null, ""website"": ""https://aedmsu.weebly.com""}",https://aedmsu.weebly.com,https://www.instagram.com/aedmsu/?hl=en,https://www.facebook.com/AlphaEpsilonDeltaMichiganState/,,
732a335a-cb3f-4b22-9289-869c51e92b23,Audio Enthusiasts and Engineers,aee,https://msu.campuslabs.com/engage/organization/aee,"AEE is a student organization that has a high level of interest in audio equipment and music. Founded in 2006, AEE's members use their skills to research, design, and build personalized audio equipment, as well as creating music. Contact Information Address 428 S Shaw Ln # 3115 East Lansing, MI 48824 Contact Email E: aeemsu@gmail.com",aeemsu@gmail.com,aeemsu@gmail.com,,,,,"{""instagram"": null, ""facebook"": null, ""twitter"": null, ""linkedin"": null, ""website"": ""http://aeemsu.com""}",http://aeemsu.com,,,,
c0fca6d7-2401-4859-80a4-01fd872485ae,Association of English Graduate Students,aegs,https://msu.campuslabs.com/engage/organization/aegs,"AEGS seeks to assist and advocate for graduate students in the Department of English by representing students on committees across the university, providing opportunities for professional development, promoting a collegial and professional atmosphere among students and faculty, and supporting graduate students at every stage of their studies",,,,,,,"{""instagram"": ""https://msu.campuslabs.comwww.instagram.com/msu_aegs"", ""facebook"": null, ""twitter"": ""https://twitter.com/@MSUAEGS"", ""linkedin"": null, ""website"": ""https://msu.campuslabs.com/engage/organization/aegs/contact""}",https://msu.campuslabs.com/engage/organization/aegs/contact,https://msu.campuslabs.comwww.instagram.com/msu_aegs,,https://twitter.com/@MSUAEGS,
