id,name,slug,url,description,emails,email,phone,address,contacts_raw,categories,socials,website,instagram,facebook,twitter,linkedin
c6f64540-7564-4d10-880d-3dc2d0c28b35,Beta Kappa Mu Inc.,betakappamu,https://msu.campuslabs.com/engage/organization/betakappamu,Contact Information Address Contact Email E: info@bkmsorority.org,info@bkmsorority.org,info@bkmsorority.org,,,,,"{""instagram"": ""https://www.instagram.com/betakappamu?igsh=MWV6ZjZweXdwdTF4OQ%3D%3D&utm_source=qr"", ""facebook"": null, ""twitter"": null, ""linkedin"": ""https://www.linkedin.com/company/betakappamu/about/?viewAsMember=true"", ""website"": ""https://www.tiktok.com/@betakappamu""}",https://www.tiktok.com/@betakappamu,https://www.instagram.com/betakappamu?igsh=MWV6ZjZweXdwdTF4OQ%3D%3D&utm_source=qr,,,https://www.linkedin.com/company/betakappamu/about/?viewAsMember=true
e592b2f7-79bd-4173-a4fc-ca8eb691f95f,Beta Theta Pi - Gamma Psi,betathetapi,https://msu.campuslabs.com/engage/organization/betathetapi,"To develop men of principle for a principled life. Contact Information Address 330 N Harrison Rd East Lansing, MI 48823 United States Contact Email E: beta.msu@gmail.com",beta.msu@gmail.com,beta.msu@gmail.com,,,,,"{""instagram"": ""https://www.instagram.com/beta_msu/?hl=en"", ""facebook"": ""https://www.facebook.com/MSUBetaThetaPi/"", ""twitter"": null, ""linkedin"": null, ""website"": ""https://msu.campuslabs.com/engage/organization/betathetapi/contact""}",https://msu.campuslabs.com/engage/organization/betathetapi/contact,https://www.instagram.com/beta_msu/?hl=en,https://www.facebook.com/MSUBetaThetaPi/,,
4bf627a5-99a7-458e-88cc-38bba4d4cb2c,Black Graduate Student Association,bgsa,https://msu.campuslabs.com/engage/organization/bgsa,"The Black Graduate Student Association has been an integral part of the Michigan State University community for a number of years. Over the past 15 years, BGSA has integrated signature programming into serving Black graduate students and the community at large, including the annual Spring Gala and Research Symposium. Additionally, BGSA has consistently created a space for Black graduate students to engage in professional development, discuss issues, and build relationships with other graduate students across disciplines through monthly meetings. Contact Information Address Contact Email E: msubgsa@gmail.com",msubgsa@gmail.com,msubgsa@gmail.com,,,,,"{""instagram"": ""https://www.instagram.com/msubgsa/"", ""facebook"": ""https://www.facebook.com/bgsa.msu"", ""twitter"": ""https://twitter.com/MSU_BGSA"", ""linkedin"": null, ""website"": ""http://msubgsa4.wixsite.com/msubgsa""}",http://msubgsa4.wixsite.com/msubgsa,https://www.instagram.com/msubgsa/,https://www.facebook.com/bgsa.msu,https://twitter.com/MSU_BGSA,
611dc8e4-fc05-4943-b4bb-1ad2b0165272,Black Girls in Social Science,bgssmsu,https://msu.campuslabs.com/engage/organization/bgssmsu,"EST JUNE 30TH 2023. “Black Girls in Social Science aims to bring together a community of Black women within the College of Social Science and provide a safe space for us to find and support one another, find resources, and bring together a community for us. We’re fostering and encouraging an inclusive environment to help see all black girls succeed socially.” Contact Information Address Contact Email E: bgssmsu@gmail.com",bgssmsu@gmail.com,bgssmsu@gmail.com,2024-2025,,,,"{""instagram"": ""https://www.instagram.com/bgssmsu/"", ""facebook"": null, ""twitter"": null, ""linkedin"": null, ""website"": ""https://msu.campuslabs.com/engage/organization/bgssmsu/contact""}",https://msu.campuslabs.com/engage/organization/bgssmsu/contact,https://www.instagram.com/bgssmsu/,,,
227e2918-5649-4c93-9520-c9be53dec8ad,CVM Black Indigenous and People of Color Club,bipoc,https://msu.campuslabs.com/engage/organization/bipoc,"BIPOC stands for Black, Indigenous, and People of Color. Our club works to facilitate dialogue, raise awareness, and continuously educate students on topics that affect the BIPOC community. This club is open to veterinary and nursing students and all faculty/staff of the CVM. We will be addressing topics such as implicit bias, microaggression, de-escalation, allyship, cultural awareness, and outreach, just to name a few. Our ultimate goal is to create a more diverse and safe environment in the veterinary community by empowering and embracing our differences. Follow us on Instagram @ msucvmbipoc Contact Information Address 784 Wilson Rd East Lansing, MI 48824 United States Contact Email E: bipocmsucvm@gmail.com Phone Number P: 517-353-5420",bipocmsucvm@gmail.com,bipocmsucvm@gmail.com,517-353-5420,,,,"{""instagram"": ""https://instagram.com/msucvmbipoc?r=nametag"", ""facebook"": ""https://www.facebook.com/groups/625037108150571/"", ""twitter"": null, ""linkedin"": null, ""website"": ""https://msu.campuslabs.com/engage/organization/bipoc/contact""}",https://msu.campuslabs.com/engage/organization/bipoc/contact,https://instagram.com/msucvmbipoc?r=nametag,https://www.facebook.com/groups/625037108150571/,,
cb1df549-d1a1-41fa-8435-d5b200965826,Broad International Student Council,bisc,https://msu.campuslabs.com/engage/organization/bisc,"Contact Information Address 239 Bogue Street East Lansing , MI 48823 United States Contact Email E: RSO.BISC@MSU.EDU Phone Number P: 2246058916",RSO.BISC@msu.edu,RSO.BISC@msu.edu,2246058916,,,,"{""instagram"": ""https://www.instagram.com/biscmsu/"", ""facebook"": ""https://www.facebook.com/broadinternationalstudentcouncil/"", ""twitter"": null, ""linkedin"": ""https://www.linkedin.com/company/broad-international-student-council/"", ""website"": ""http://rsobisc.wixsite.com/msubisc""}",http://rsobisc.wixsite.com/msubisc,https://www.instagram.com/biscmsu/,https://www.facebook.com/broadinternationalstudentcouncil/,,https://www.linkedin.com/company/broad-international-student-council/
7a478f05-9fdd-403b-bdac-a7f4e9cdfbed,Beta Kappa Nu Inc.,bkn,https://msu.campuslabs.com/engage/organization/bkn,,,,,,,,"{""instagram"": null, ""facebook"": null, ""twitter"": null, ""linkedin"": null, ""website"": ""https://msu.campuslabs.com/engage/organization/bkn/contact""}",https://msu.campuslabs.com/engage/organization/bkn/contact,,,,
e21174bd-63a4-48b7-9649-ce95d062a441,Black and Broad,blackandbroad,https://msu.campuslabs.com/engage/organization/blackandbroad,We aim to support and represent Black business minded students. Create a safe space where Black Diaspora students can express their concerns and find solutions to succeed. We also aim to be a pipeline of resources and academic help for students to succeed at the Eli Broad college of Business. Contact Information Address Contact Email E: blackandbroad@gmail.com,blackandbroad@gmail.com,blackandbroad@gmail.com,,,,,"{""instagram"": ""https://instagram.com/blackandbroad?igshid=MzRlODBiNWFlZA=="", ""facebook"": null, ""twitter"": null, ""linkedin"": ""https://www.linkedin.com/in/black-and-broad-0792a5247/"", ""website"": ""https://www.tiktok.com/@Blackandbroad""}",https://www.tiktok.com/@Blackandbroad,https://instagram.com/blackandbroad?igshid=MzRlODBiNWFlZA==,,,https://www.linkedin.com/in/black-and-broad-0792a5247/
36f87332-5479-429b-b423-5afd47cfa44e,Black Girl Fitness,blackgirlfitness,https://msu.campuslabs.com/engage/organization/blackgirlfitness,"The objective of Black Girl Fitness is to increase the number of women who not only lead a healthier lifestyle, but can have a comfortable setting to reach their fitness goals. Michigan State students will be able to partake in physical activity, a diverse number of fitness routines, as well as active discussions and information on better living. Contact Information Address Contact Email E: bgfmsu@gmail.com",bgfmsu@gmail.com,bgfmsu@gmail.com,,,,,"{""instagram"": ""https://www.instagram.com/bgfmsu/?hl=en"", ""facebook"": null, ""twitter"": null, ""linkedin"": null, ""website"": ""https://linktr.ee/bgfmsu""}",https://linktr.ee/bgfmsu,https://www.instagram.com/bgfmsu/?hl=en,,,
0da641c3-3c7f-40c2-b7ee-67d255c2123c,Black Students' Alliance,blackstudentalliance,https://msu.campuslabs.com/engage/organization/blackstudentalliance,"The Black Students' Alliance was created to serve as the central resource organization for all Black students on the campus of Michigan State University. The mission of Black Students' Alliance is to promote, encourage, and enhance the academic, cultural, political, professional, and social progress of the Black community through the central programming initiatives of the Board of Directors. Contact Information Address 964 Hubbard Rd G-25 East Lansing, MI 48823 United States Contact Email E: bsaemail2@gmail.com Phone Number P: 910-713-5408",bsaemail2@gmail.com,bsaemail2@gmail.com,910-713-5408,,,,"{""instagram"": ""https://www.instagram.com/msu_bsa/"", ""facebook"": null, ""twitter"": ""https://twitter.com/msu_BSA"", ""linkedin"": null, ""website"": ""http://www.bsamsu.weebly.com""}",http://www.bsamsu.weebly.com,https://www.instagram.com/msu_bsa/,,https://twitter.com/msu_BSA,
04c2f87f-29d4-44a4-8c21-b9dd7db9f9ba,Black Student Nurses Association,blackstudentnursingassociation,https://msu.campuslabs.com/engage/organization/blackstudentnursingassociation,"BSNA purpose is to promote diversity in the nursing profession & inspire future leaders who will make a significant impact in the field of nursing through mentorship, education, & collaboration, we strive to address healthcare disparities. Contact Information Address Contact Email E: bsna.msu@gmail.com",bsna.msu@gmail.com,bsna.msu@gmail.com,,,,,"{""instagram"": ""https://www.instagram.com/msu_bsna/"", ""facebook"": null, ""twitter"": null, ""linkedin"": null, ""website"": ""https://msu.campuslabs.com/engage/organization/blackstudentnursingassociation/contact""}",https://msu.campuslabs.com/engage/organization/blackstudentnursingassociation/contact,https://www.instagram.com/msu_bsna/,,,
66a8f8c4-8b0e-4986-bf22-34ac03a935a7,"Bladesmithing, MSU",bladesmithing,https://msu.campuslabs.com/engage/organization/bladesmithing,"The Bladesmithing Team at Michigan State is a group focused on teaching and applying engineering fundamentals to bladesmithing. The team consists mainly of material science and engineering undergraduates which leads to a focus on heat treatment, microstructure, and mechanical properties in the process of crafting a blade. The main goal of the team is to create a competition quality knife for the TMS Bladesmithing Competition that occurs every other year. The team has recently undergone a restart and plans on entering its first competition in 2026. Contact Information Address 428 South Shaw Lane East Lansing, MI 48824 United States Contact Email E: RSO.msubladesmithing@msu.edu",RSO.msubladesmithing@msu.edu,RSO.msubladesmithing@msu.edu,,,,,"{""instagram"": ""https://www.instagram.com/msu_bladesmithing?igsh=MW5ua2czeTE0MHB0eQ=="", ""facebook"": null, ""twitter"": null, ""linkedin"": null, ""website"": ""https://msu.campuslabs.com/engage/organization/bladesmithing/contact""}",https://msu.campuslabs.com/engage/organization/bladesmithing/contact,https://www.instagram.com/msu_bladesmithing?igsh=MW5ua2czeTE0MHB0eQ==,,,
c3e5ed66-7fa7-4d5c-acc2-3e0d0c69a5df,Biomedical Laboratory Diagnostics Student Association,bldsa,https://msu.campuslabs.com/engage/organization/bldsa,"The Biomedical Laboratory Diagnostics Student Association (BLDSA) is a student led association that coordinates events for students to make connections, hear from guest speakers and ask questions about their experiences, and provides opportunities to participate in community service. Contact Information Address 354 Farm Ln East Lansing, MI 48824 United States Contact Email E: strayer5@msu.edu Phone Number P: 9895788040",strayer5@msu.edu,strayer5@msu.edu,9895788040,,,,"{""instagram"": ""https://www.instagram.com/msubldsa/?hl=en"", ""facebook"": ""https://www.facebook.com/MSUBLD/"", ""twitter"": null, ""linkedin"": null, ""website"": ""https://bld.natsci.msu.edu/students/student-association/""}",https://bld.natsci.msu.edu/students/student-association/,https://www.instagram.com/msubldsa/?hl=en,https://www.facebook.com/MSUBLD/,,
e0305e29-8c97-4233-bbf7-35a960d16a2c,Biochemistry & Molecular Biology Undergraduate Club,bmb-club,https://msu.campuslabs.com/engage/organization/bmb-club,"As a member of MSU's BMB Club, you will be exposed to information related to research, academics, internship opportunities, graduate school applications, career opportunities while also creating connections with your fellow classmates. Contact Information Address Biomedical and Physical Sciences East Lansing, MI 48824 United States Contact Email E: RSO.bmbclub@msu.edu",RSO.bmbclub@msu.edu,RSO.bmbclub@msu.edu,,,,,"{""instagram"": ""https://www.instagram.com/msubiochem/?hl=en"", ""facebook"": null, ""twitter"": null, ""linkedin"": null, ""website"": ""https://bmb.natsci.msu.edu/undergraduate/undergraduate-club.aspx""}",https://bmb.natsci.msu.edu/undergraduate/undergraduate-club.aspx,https://www.instagram.com/msubiochem/?hl=en,,,
d37c2b45-4f64-4b85-a256-da6c12406dd8,Biomedical Engineering Graduate Student Association,bmegsa,https://msu.campuslabs.com/engage/organization/bmegsa,"Primary activities of the BME GSA include graduate student engagement in the BME Department, social and career development events, coordination with BME Department faculty, and graduate student representation in BME Department matters. Contact Information Address 775 Woodlot Dr. East Lansing, MI 48823 United States Contact Email E: rso.bme@msu.edu",rso.bme@msu.edu,rso.bme@msu.edu,,,,,"{""instagram"": ""https://www.instagram.com/msubmegsa/"", ""facebook"": null, ""twitter"": null, ""linkedin"": null, ""website"": ""https://msu.campuslabs.com/engage/organization/bmegsa/contact""}",https://msu.campuslabs.com/engage/organization/bmegsa/contact,https://www.instagram.com/msubmegsa/,,,
2a423ead-ca06-4c4b-b079-7c44b0fcebda,Biomedical Engineering Society,bmesmsu,https://msu.campuslabs.com/engage/organization/bmesmsu,"Promote the profession of biomedical engineering through the organized effort of this group in the study, research, and discussion of the fields of biomedical engineering, and the dissemination of the knowledge thereby gained.",,,,,,Biomedical Engineering Society,"{""instagram"": ""https://www.instagram.com/officialmsubmes/"", ""facebook"": null, ""twitter"": null, ""linkedin"": null, ""website"": ""https://bmesmsu.wixsite.com/hello""}",https://bmesmsu.wixsite.com/hello,https://www.instagram.com/officialmsubmes/,,,
604a3f98-cd7a-4bea-9d13-5c62a0b280e7,College of Law Board of Advocates,boardofadvocates,https://msu.campuslabs.com/engage/organization/boardofadvocates,"The Board of Advocates at Michigan State University – College of Law is a student organization dedicated to intensive advocacy training in a competitive environment. The Board of Advocates consists of all members of Michigan State University College of Law Competition teams led by an elected Executive Board. The program provides students the opportunity to further develop written, oral and team-based advocacy skills. Each year, members of the Board travel across the country to compete against other law schools for top honors. The Board of Advocates has developed a prestigious national presence, built by years of hard work and dedicated members. The Board looks forward to carrying on this winning tradition far into the future. Contact Information Address 648 N Shaw Ln East Lansing , MI 48824 United States Contact Email E: diaznaye@msu.edu Phone Number P: 210-845-7494",diaznaye@msu.edu,diaznaye@msu.edu,210-845-7494,,,,"{""instagram"": ""https://www.instagram.com/msu_boardofadvocates/?utm_medium=copy_link"", ""facebook"": null, ""twitter"": null, ""linkedin"": null, ""website"": ""https://www.law.msu.edu/students/student-org-profile.php?id=138""}",https://www.law.msu.edu/students/student-org-profile.php?id=138,https://www.instagram.com/msu_boardofadvocates/?utm_medium=copy_link,,,
9b68ea98-fdbe-408d-89dd-a323752edfe3,Bowling Club,bowling,https://msu.campuslabs.com/engage/organization/bowling,"Contact Information Address 5510 Fiesta Pass Grand Blanc, MI 48439 United States Contact Email E: rso.clubbowling@msu.edu Phone Number P: 2699089403",rso.clubbowling@msu.edu,rso.clubbowling@msu.edu,2699089403,,,,"{""instagram"": ""https://www.instagram.com/msuclubbowling/"", ""facebook"": ""https://www.facebook.com/MSUClubBowling/"", ""twitter"": null, ""linkedin"": null, ""website"": ""https://msu.campuslabs.com/engage/organization/bowling/contact""}",https://msu.campuslabs.com/engage/organization/bowling/contact,https://www.instagram.com/msuclubbowling/,https://www.facebook.com/MSUClubBowling/,,
429f036e-040f-447e-abd4-d1b5de2cf12b,"Boxing Club, Spartan",boxing,https://msu.campuslabs.com/engage/organization/boxing,,,,,,,,"{""instagram"": null, ""facebook"": null, ""twitter"": null, ""linkedin"": null, ""website"": ""https://msu.campuslabs.com/engage/organization/boxing/contact""}",https://msu.campuslabs.com/engage/organization/boxing/contact,,,,
b37f44c4-39b6-4766-8edf-b7900a59ff72,Brain Exercise Initiative,brainexerciseinitiative,https://msu.campuslabs.com/engage/organization/brainexerciseinitiative,"We are a 501(c)(3) nonprofit organization that uses simple math, writing, and reading aloud exercises as an intervention to improve cognitive function in those with Alzheimer's Disease. We encourage intergenerational collaboration between university students and elders. We will be working with rehab centers in the EL area to increase community and university outreach. Contact Information Address Contact Email E: RSO.msu_bei@msu.edu",RSO.msu_bei@msu.edu,RSO.msu_bei@msu.edu,,,,,"{""instagram"": ""https://instagram.com/msu_bei?utm_medium=copy_link"", ""facebook"": ""https://www.facebook.com/BEIMSU"", ""twitter"": null, ""linkedin"": null, ""website"": ""https://www.brainexerciseinitiative.com/""}",https://www.brainexerciseinitiative.com/,https://instagram.com/msu_bei?utm_medium=copy_link,https://www.facebook.com/BEIMSU,,
5a02be86-cbf3-4e1c-993a-903325f33a07,"Black Researchers and Advocates for Nature, Culture, and Horticulture",branch,https://msu.campuslabs.com/engage/organization/branch,,,,,,,,"{""instagram"": ""https://www.instagram.com/branch_msu?utm_source=ig_web_button_share_sheet&igsh=ZDNlZDc0MzIxNw=="", ""facebook"": null, ""twitter"": null, ""linkedin"": null, ""website"": ""https://msu.campuslabs.com/engage/organization/branch/contact""}",https://msu.campuslabs.com/engage/organization/branch/contact,https://www.instagram.com/branch_msu?utm_source=ig_web_button_share_sheet&igsh=ZDNlZDc0MzIxNw==,,,
11671d9a-72c1-4ccf-831a-14568f083a3f,BRASA at MSU,brasaatmsu,https://msu.campuslabs.com/engage/organization/brasaatmsu,"BRASA at MSU is a Registered Student Organization dedicated to offering an interactive and supportive resource for anyone interested in the Brazilian culture. Our goal is to enhance the understanding and appreciation of the Brazilian culture and the Portuguese language throughout the East Lansing Campus and the surrounding areas. For Brazilian students, we serve as a home away from home, fostering a welcoming environment to build connections among ourselves. Contact Information Address Contact Email E: msu@brasalocal.org",msu@brasalocal.org,msu@brasalocal.org,,,,,"{""instagram"": ""https://www.instagram.com/brasamsu/?hl=en"", ""facebook"": null, ""twitter"": null, ""linkedin"": null, ""website"": ""https://msu.campuslabs.com/engage/organization/brasaatmsu/contact""}",https://msu.campuslabs.com/engage/organization/brasaatmsu/contact,https://www.instagram.com/brasamsu/?hl=en,,,
0417dcb8-fb1f-4e24-ab5f-b9161a0e6382,Brazilian Jiu Jitsu Club,brazilianjiujitsu,https://msu.campuslabs.com/engage/organization/brazilianjiujitsu,"The Brazilian Jiu-Jitsu Club will meet weekly in IM West to practice and learn BJJ. The goal of this organization is to create a welcoming and safe place for all MSU students interested in learning BJJ regardless of experience. Meetings are held on Sundays at noon in the IM West Judo Room. Mission: Create an organization capable of teaching any and all members Brazilian Jiu-Jitsu in a safe and controlled environment. Vision: An inclusive space where all people passionate about the sport can come to practice, learn, and grow together. Values: Provide a welcoming community for everyone, and uphold moral standards of equity and justness for all participants. Learn self-defense, build confidence, discipline, and community. Join BJJ!!! Follow our Instagram for updates: msu_bjj Contact Information Address 393 Chestnut Road East Lansing, MI 48824 East Lansing, MI 48823 United States",,,,,,,"{""instagram"": null, ""facebook"": null, ""twitter"": null, ""linkedin"": null, ""website"": ""https://msu.campuslabs.com/engage/organization/brazilianjiujitsu/contact""}",https://msu.campuslabs.com/engage/organization/brazilianjiujitsu/contact,,,,
993d1e38-5e16-403b-845f-1ecd687301be,"Breaking Club, MSU",breakdance,https://msu.campuslabs.com/engage/organization/breakdance,"MSU Breakdance provides an open space to learn breaking, principles of dance, and learn about the culture and lifestyle of Hip-Hop. Within breaking, we teach the core fundamentals, how to implement your personality into those fundamentals and help you grow as a dancer, which in turn grows the community. No prior dance experience is required, so if you ever had an interest in the art of breaking, hit us up! Practices are every Tuesday from 8-10pm in IM Circle Upper Gym! Contact Information Address 308 W Circle Dr East Lansing, MI 48824 United States Contact Email E: msubreakdance@gmail.com",msubreakdance@gmail.com,msubreakdance@gmail.com,,,,,"{""instagram"": ""https://www.instagram.com/msubreakdanceclub/"", ""facebook"": ""https://www.facebook.com/msubreakdance"", ""twitter"": null, ""linkedin"": null, ""website"": ""https://www.youtube.com/user/msubreakdanceclub""}",https://www.youtube.com/user/msubreakdanceclub,https://www.instagram.com/msubreakdanceclub/,https://www.facebook.com/msubreakdance,,
26f7f4c5-7f9a-4c92-974f-73851530fcf3,Bridges International,bridges,https://msu.campuslabs.com/engage/organization/bridges,"We are an organization for international and American students. By joining us, you can find friends from the US and around the world and find help adjusting to life in America and East Lansing. We describe ourselves as a Social network, Service, and a Spiritual resource. We have events throughout the semester. Once a week, we will meet for dinner and/or hangout. During the event you can make new friends, have meaningful discussion, and play fun games. Hope you can join us! Contact Information Address United States Contact Email E: Jheitz@msu.edu",Jheitz@msu.edu,Jheitz@msu.edu,,,,,"{""instagram"": ""https://www.instagram.com/bridgesatstate/"", ""facebook"": ""https://www.facebook.com/bridgesatstate/"", ""twitter"": null, ""linkedin"": null, ""website"": ""http://www.msubridges.com""}",http://www.msubridges.com,https://www.instagram.com/bridgesatstate/,https://www.facebook.com/bridgesatstate/,,
6f34e3f9-d14b-458a-9bf9-9df94744dd48,BridginGaps,bridgingaps,https://msu.campuslabs.com/engage/organization/bridgingaps,Contact Information Address Contact Email E: Almatro3@msu.edu Phone Number P: 7346868922,Almatro3@msu.edu,Almatro3@msu.edu,7346868922,,,,"{""instagram"": null, ""facebook"": null, ""twitter"": null, ""linkedin"": null, ""website"": ""https://msu.campuslabs.com/engage/organization/bridgingaps/contact""}",https://msu.campuslabs.com/engage/organization/bridgingaps/contact,,,,
b324e6ab-d000-49fa-bc77-6d4f1ee78325,Bright Futures,brightfutures,https://msu.campuslabs.com/engage/organization/brightfutures,"The Bright Futures Program is focused on bringing free tutoring to local K-12 students who would not be able to afford it or would not have access to it otherwise. This includes but is not limited to: Students who are currently on the Free Lunches program, Students currently in juvenile correction facilities, and Students who are currently emancipated or homeless. We value leadership, mentorship, and overall reliability in our determination to help those that may have the greatest need for it. Contact Information Address 846 Service Rd East Lansing, MI 48824 United States Contact Email E: info@nucleustutoring.com Phone Number P: 616-755-6298",info@nucleustutoring.com,info@nucleustutoring.com,616-755-6298,,,,"{""instagram"": null, ""facebook"": null, ""twitter"": null, ""linkedin"": null, ""website"": ""https://www.nucleustutoring.com/brightfutures""}",https://www.nucleustutoring.com/brightfutures,,,,
9e448f4f-0164-45e1-93e2-918894f04a0e,Bright Smiles Club,brightsmilesclub,https://msu.campuslabs.com/engage/organization/brightsmilesclub,"The purpose of this organization shall be to create a positive, uplifting, and supportive studying group for pre-dental students who are taking the DAT or looking to further improve their education in a healthy environment. Our vision is to guide each other through interview processes, DAT testing, and dental internships. By bringing in resources such as books, research, and doctors aiding us in our future educational journeys we gain insights from other experiences and the close knit community of dentistry. Our core values as a club are integrity, passion, kindness, respect, collaboration, and growth as a whole as pre-health students. Hoping to accomplish pre-dental students to become more enlightened and a supportive new group Contact Information Address 918 East Grand River East Lansing, MI 48825 United States Contact Email E: ande2441@msu.edu Phone Number P: 6168433439",ande2441@msu.edu,ande2441@msu.edu,6168433439,,,,"{""instagram"": null, ""facebook"": null, ""twitter"": null, ""linkedin"": null, ""website"": ""https://msu.campuslabs.com/engage/organization/brightsmilesclub/contact""}",https://msu.campuslabs.com/engage/organization/brightsmilesclub/contact,,,,
