id,name,slug,url,description,emails,email,phone,address,contacts_raw,categories,socials,website,instagram,facebook,twitter,linkedin
5ebfc60b-cdad-49a4-a265-23e8442d9211,COM Latino Medical Student Association,lmsa,https://msu.campuslabs.com/engage/organization/lmsa,"Contact Information Address 965 Wilson Rd East Lansing, MI 48824 USA Contact Email E: com.lmsa.msu@gmail.com",com.lmsa.msu@gmail.com,com.lmsa.msu@gmail.com,,,,,"{""instagram"": ""http://www.instagram.com/lmsa_msucom"", ""facebook"": null, ""twitter"": null, ""linkedin"": null, ""website"": ""https://msu.campuslabs.com/engage/organization/lmsa/contact""}",https://msu.campuslabs.com/engage/organization/lmsa/contact,http://www.instagram.com/lmsa_msucom,,,
89d6de0d-42f8-448b-bfa7-fa615e642390,Broad MBA Association,mbaa,https://msu.campuslabs.com/engage/organization/mbaa,"The MBAA has two distinct missions: The first is to promote a socially connected and inclusive community within the program and the second is to represent the student body to the administration and to act as a liaison for all program-related issues. To promote a strong social culture within the program, the MBAA organizes, funds, and/or facilitates a variety of social events that are open to all members and are intended to broadly benefit the MBA community as a whole. Contact Information Address 651 N. Shaw Lane, Rm M100 East Lansing, MI 48824 United States Contact Email E: mbaa@broad.msu.edu",mbaa@broad.msu.edu,mbaa@broad.msu.edu,,,,,"{""instagram"": null, ""facebook"": null, ""twitter"": null, ""linkedin"": null, ""website"": ""https://msu.campuslabs.com/engage/organization/mbaa/contact""}",https://msu.campuslabs.com/engage/organization/mbaa/contact,,,,
269bf4e4-ee5f-4c18-ba9b-a0ccae621109,Broad MBA Human Resources Association,mbahra,https://msu.campuslabs.com/engage/organization/mbahra,"The Broad MBA Human Resources Association is so back! Do not confuse our club with simply being a Recruiter or confirming PTO benefits for employees. As you gain work experience, you will realize how much information flows through the Human Resources department - hybrid work policies, mergers & acquisitions, executive recruiting, and more. This club aims to focus on these broader, strategic aspects of organizations. We will explore company examples and walk through real-life scenarios while hearing from seasoned MSU alumni who can speak to current trends and lessons learned during their time in the workforce. When envisioning life after Business school, images of working on complicated stock options, pouring through financial statements, or pitching Mad Men style presentations come to mind. But none of these scenarios could exist without the strategic thinking of the Human Resources department. As you re-enter the workforce, what would make you pick one company over another? Company culture, management style, overall direction? And what if your company gets acquired? Will there be a role for you once the acquisition is complete? When you become a manager, will you be able to navigate employment laws and retain employees? We will tackle the answers to these questions, so join us! Contact Information Address Contact Email E: mbahra@broad.msu.edu",mbahra@broad.msu.edu,mbahra@broad.msu.edu,,,,,"{""instagram"": null, ""facebook"": null, ""twitter"": null, ""linkedin"": null, ""website"": ""https://msu.campuslabs.com/engage/organization/mbahra/contact""}",https://msu.campuslabs.com/engage/organization/mbahra/contact,,,,
c171b0fa-a0b9-4ac5-957f-79036c7f46d9,College of Human Medicine Medical Student Pride Alliance,mspachm,https://msu.campuslabs.com/engage/organization/mspachm,"MSU-CHM MSPA is established for the expressed purpose of increasing the competency and confidence of medical students, healthcare professionals, and faculty in serving LGBTQIA+ patient populations. Through campus involvement, workshops, and community outreach, our mission is to improve the health of LGBTQIA+ patient populations and to take steps to acknowledge and address the injustices that contribute to health disparities in marginalized communities, specifically POC and trans folks. We believe it is important to center POC and trans folks in the work of the organization because of the way that intersectionality impacts people who belong to multiple minority groups. Contact Information Address 804 Service Road Suite A112 East Lansing , MI 48824 United States of America Contact Email E: mspachm@gmail.com",mspachm@gmail.com,mspachm@gmail.com,,,,,"{""instagram"": ""https://www.instagram.com/mspa.chm"", ""facebook"": ""https://www.facebook.com/groups/184147946318644"", ""twitter"": null, ""linkedin"": null, ""website"": ""https://msu.campuslabs.com/engage/organization/mspachm/contact""}",https://msu.campuslabs.com/engage/organization/mspachm/contact,https://www.instagram.com/mspa.chm,https://www.facebook.com/groups/184147946318644,,
95573fab-d367-457d-b532-de06181d0823,Association of Asian Veterinary Medical Professionals,msu-aavmp,https://msu.campuslabs.com/engage/organization/msu-aavmp,"The mission of MSU AAVMP is to foster a community of APIDA-identifying veterinary students and professionals. MSU AAVMP strives to advocate for overall diversity in veterinary medical professionals by inspiring, supporting, and increasing the core values of representation, mentorship, advocacy, and fellowship. By offering professional and educational resources within the AAVMP network, we hope to foster success for APIDA veterinary, pre-veterinary and veterinary nursing students through mentorship and shared cultural experiences. MSU AAVMP will seek to unite and support the APIDA veterinary community and demonstrate allyship alongside other APIDA interest groups at MSU for all faculty, staff, and students. Contact Information Address Contact Email E: aavmpatmichiganstate@gmail.com",aavmpatmichiganstate@gmail.com,aavmpatmichiganstate@gmail.com,,,,,"{""instagram"": ""https://www.instagram.com/aavmpatmichiganstate/"", ""facebook"": null, ""twitter"": null, ""linkedin"": null, ""website"": ""https://msu.campuslabs.com/engage/organization/msu-aavmp/contact""}",https://msu.campuslabs.com/engage/organization/msu-aavmp/contact,https://www.instagram.com/aavmpatmichiganstate/,,,
1fabff9b-3109-4b20-bb1a-17a3c22be3d0,"D3 Men's Club Hockey, MSU",msu-acha-diii,https://msu.campuslabs.com/engage/organization/msu-acha-diii,"Contact Information Address 1023 E Grand River Ave East Lansing, MI 48825 United States Contact Email E: marsallo@msu.edu Phone Number P: 3152978535",marsallo@msu.edu,marsallo@msu.edu,3152978535,,,,"{""instagram"": null, ""facebook"": null, ""twitter"": null, ""linkedin"": null, ""website"": ""https://www.htosports.com/teams/?u=MSUD3HOCKEY&s=hockey""}",https://www.htosports.com/teams/?u=MSUD3HOCKEY&s=hockey,,,,
611951e5-5d53-4dfb-b1d4-36c560307810,American Medical Women's Association for MSU Undergraduates,msu-amwa,https://msu.campuslabs.com/engage/organization/msu-amwa,"AMWA is the oldest multispecialty organization dedicated to advancing women in medicine and improving women’s health. Our membership is comprised of physicians, residents, medical students, pre-medical students, health care professionals, and supporters. Mission To advance women in medicine, advocate for equity, and ensure excellence in health care. Vision A healthier world where women physicians achieve equity in the medical profession and realize their full potential. Values Integrity Equity Diversity Inclusion Collaboration Mentorship Contact Information Address Contact Email E: AMWAmsuorg@gmail.com",AMWAmsuorg@gmail.com,AMWAmsuorg@gmail.com,,,,American Medical Women's Association,"{""instagram"": ""https://www.instagram.com/amwa.undergradmsu/"", ""facebook"": ""https://www.facebook.com/groups/1208744746465632"", ""twitter"": null, ""linkedin"": null, ""website"": ""https://amwaundergradmsu.weebly.com/""}",https://amwaundergradmsu.weebly.com/,https://www.instagram.com/amwa.undergradmsu/,https://www.facebook.com/groups/1208744746465632,,
d7efb776-2e2b-4dc0-9370-f66972156b95,"ASCE Geotech, MSU",msu_asce_geotech,https://msu.campuslabs.com/engage/organization/msu_asce_geotech,"MSU ASCE Geotech is a student-led organization dedicated to fostering interest and advancing knowledge in the field of Geotechnical Engineering. Open to both undergraduate and graduate students, this organization provides a collaborative platform for individuals passionate about geotechnical topics, from soil mechanics to foundations, geotechnical design, and beyond. Through a variety of activities, including guest lectures, hands-on projects, field trips, and participation in regional and national geotechnical competitions, members will have the opportunity to engage with professionals in the industry, enhance their technical skills, and build lasting connections within the geotechnical community. Whether you’re looking to deepen your understanding of geotechnical principles, collaborate on exciting projects, or network with industry leaders, MSU ASCE Geotech offers a supportive environment for all students interested in pursuing careers in Geotechnical Engineering. Join us and help shape the future of Geotechnical Engineering at MSU! Contact Information Address ENGINEERING BLDG 428 S SHAW LN East Lansing, MI 48823 United States Contact Email E: dwivedi8@msu.edu",dwivedi8@msu.edu,dwivedi8@msu.edu,,,,,"{""instagram"": null, ""facebook"": null, ""twitter"": null, ""linkedin"": null, ""website"": ""https://msu.campuslabs.com/engage/organization/msu_asce_geotech/contact""}",https://msu.campuslabs.com/engage/organization/msu_asce_geotech/contact,,,,
77cb8bbf-28c9-407d-b0ae-70cdf6c3d4b2,Down to Dance,msu_downtodance,https://msu.campuslabs.com/engage/organization/msu_downtodance,"The purpose of this organization shall be utilizing dance to help improve cognitive functioning, motor skills and social inclusivity of children with Down Syndrome. This organization is based on arts and medicine research and will host dance workshops for individuals with Down Syndrome and participate in fundraising to increase awareness and research for Down Syndrome. We will be conducting these workshops and be affiliated with Capital Area Down Syndrome Association (CADSA) in East Lansing, Michigan. Contact Information Address Contact Email E: msudowntodance@gmail.com",msudowntodance@gmail.com,msudowntodance@gmail.com,,,,,"{""instagram"": ""https://www.instagram.com/msu_downtodance"", ""facebook"": null, ""twitter"": null, ""linkedin"": null, ""website"": ""https://msu.campuslabs.com/engage/organization/msu_downtodance/contact""}",https://msu.campuslabs.com/engage/organization/msu_downtodance/contact,https://www.instagram.com/msu_downtodance,,,
aff34df7-7242-4ea4-bc15-b9131e893025,"Advertising Association, Michigan State University",msuaa,https://msu.campuslabs.com/engage/organization/msuaa,"MSUAA is a professional networking club made up of passionate students wanting to learn more about the advertising industry. We host weekly meetings with industry professionals and learn about their experiences in the advertising world. By joining, you will have the opportunity to expand your knowledge of the advertising industry and grow your network. Check out our website! Contact Information Address 404 Wilson Rd East Lansing, MI 48823 United States Contact Email E: msuadvassociation@gmail.com",msuadvassociation@gmail.com,msuadvassociation@gmail.com,,,,,"{""instagram"": ""https://www.instagram.com/msuadassociation/"", ""facebook"": null, ""twitter"": null, ""linkedin"": ""https://www.linkedin.com/company/msu-ad-association/"", ""website"": ""https://www.msuadvertisingassociation.com/""}",https://www.msuadvertisingassociation.com/,https://www.instagram.com/msuadassociation/,,,https://www.linkedin.com/company/msu-ad-association/
0560b9fa-7ba2-4b3a-bb53-472688230b7a,Alpha Epsilon Pi,msuaepi,https://msu.campuslabs.com/engage/organization/msuaepi,"Contact Information Address 225 N Harrison Rd East Lansing, MI 48823 United States Contact Email E: glaserel@msu.edu Phone Number P: 216-644-3544",glaserel@msu.edu,glaserel@msu.edu,216-644-3544,,,,"{""instagram"": null, ""facebook"": null, ""twitter"": null, ""linkedin"": null, ""website"": ""http://aepi.org""}",http://aepi.org,,,,
08a81f66-bfff-464b-a18f-d24179a30033,Artificial Intelligence Club at Michigan State University,msuaiclub,https://msu.campuslabs.com/engage/organization/msuaiclub,"We are a fast-growing club at Michigan State University driven by the passion and curiosity for one of the most promising branches of Computer Science: Artificial Intelligence. Our mission is to empower students with the knowledge of Artificial Intelligence through an inclusive environment that closes the gap between curiosity and hands-on practice in the field. We want to become Michigan State University’s hub for the learning and application of Artificial Intelligence among undergraduate students. Interested in becoming a member? Visit our website , where you can find more information about our club. Contact Information Address Contact Email E: msuaiclub@gmail.com",msuaiclub@gmail.com,msuaiclub@gmail.com,,,,,"{""instagram"": ""https://instagram.com/msu_ai_club"", ""facebook"": ""https://www.facebook.com/aiclubmsu"", ""twitter"": null, ""linkedin"": ""https://www.linkedin.com/company/msu-ai"", ""website"": ""http://www.msuaiclub.com""}",http://www.msuaiclub.com,https://instagram.com/msu_ai_club,https://www.facebook.com/aiclubmsu,,https://www.linkedin.com/company/msu-ai
ef58e1ee-24af-478e-be56-4ad02ca8d4be,American Indian Science and Engineering Society,msuaises,https://msu.campuslabs.com/engage/organization/msuaises,"The vision of the American Indian Science and Engineering Society (AISES) is for the next seven generations of Native people to be successful, respected, influential, and contributing members of our vast and ever-changing global community. We will have bi-weekly meetings to promote opportunities that benefit organizational members. The group will also work to attend the national AISES Conference. Contact Information Address 102 Agriculture Hall East Lansing, MI 48924 US Contact Email E: sorroche@msu.edu",sorroche@msu.edu,sorroche@msu.edu,,,,,"{""instagram"": null, ""facebook"": null, ""twitter"": null, ""linkedin"": null, ""website"": ""https://www.aises.org/students""}",https://www.aises.org/students,,,,
8e80481e-1236-4f91-8600-4c484558a909,Animal and Natural Resource Law Review,msuanrlr,https://msu.campuslabs.com/engage/organization/msuanrlr,The Animal & Natural Resource Law Review (“the Law Review”) at the Michigan State University College of Law (“MSU Law”) is a student organization that publishes at least one Law Review volume annually. The Law Review publishes the academic articles in the rapidly expanding field of animal law as well as natural resource law. The Law Review aims to inform and educate both members of the legal community and the public at large about issues in the cutting-edge fields of animal law and natural resource law. The Law Review is operated by an editorial board (“the Editorial Board”) along with a faculty advisor. Contact Information Address Contact Email E: msuanrlr@gmail.com,msuanrlr@gmail.com,msuanrlr@gmail.com,,,,,"{""instagram"": null, ""facebook"": ""https://www.facebook.com/msujanrl/"", ""twitter"": null, ""linkedin"": null, ""website"": ""http://msujanrl.org""}",http://msujanrl.org,,https://www.facebook.com/msujanrl/,,
e5f4724e-8ac2-48f7-a360-c23782acb7ea,Anesthesia and Pain Society,msuaps,https://msu.campuslabs.com/engage/organization/msuaps,"Anesthesia and Pain Society (APS) strives to provide undergraduate students exposure to the field of anesthesiology and pain management along with several subspecialties through a variety of workshops and informational meetings. Students have the opportunity to participate in relevant clinical skills workshops, such as intubations, IV and central line placement, and more. Students will be able to attend professional development seminars, enhancing their networking, resume-building, and interpersonal skills. These seminars will offer resources that better prepare future medical school applicants for the rigor of the application process. Contact Information Address 36988 Kingsburn Dr. Livonia, MI 48152 United States Contact Email E: rejijade@msu.edu Phone Number P: 7346589042",rejijade@msu.edu,rejijade@msu.edu,7346589042,,,,"{""instagram"": ""https://www.instagram.com/msu_aps?utm_source=ig_web_button_share_sheet&igsh=ZDNlZDc0MzIxNw=="", ""facebook"": null, ""twitter"": null, ""linkedin"": null, ""website"": ""https://msu.campuslabs.com/engage/organization/msuaps/contact""}",https://msu.campuslabs.com/engage/organization/msuaps/contact,https://www.instagram.com/msu_aps?utm_source=ig_web_button_share_sheet&igsh=ZDNlZDc0MzIxNw==,,,
6de58ee2-f07b-4e1f-91a8-69c9b5ca2dbb,Amateur Radio Club,msuarc,https://msu.campuslabs.com/engage/organization/msuarc,"The first radio station at Michigan State University was established through the efforts of the Amateur Radio Club in 1919 using the call letters of 8YG - broadcasting weather reports and farm market prices. In 1925 8YG became WKAR, the public broadcast station of Michigan State University, while a ham radio station was formed using the call letters 8XBU. In 1927 the call 8SH was issued to the amateur radio station. Today the MSU Amateur Radio Club operates W8SH and W8MSU from the campus in East Lansing. Please see our main website for more information on who we are, what we do, how to become a member, and about HAM radio in general: MSU Amateur Radio Club – Amateur Radio at Michigan State University You can also join our Discord page: https://discord.gg/MhWr3eefHE We would be happy to answer any questions you may have, and club members are frequently willing to meet and give tours of our 'shack' in Engineering Building room 2121. Contact Information Address 428 South Shaw Lane Room 2121 East Lansing, MI 48824 United States Contact Email E: msuamateurradioclub@gmail.com Phone Number P: 517-353-5214",msuamateurradioclub@gmail.com,msuamateurradioclub@gmail.com,517-353-5214,,,,"{""instagram"": ""https://www.instagram.com/msuarc"", ""facebook"": ""https://www.facebook.com/W8MSU/"", ""twitter"": ""https://twitter.com/W8MSU"", ""linkedin"": null, ""website"": ""https://msuarc.egr.msu.edu/""}",https://msuarc.egr.msu.edu/,https://www.instagram.com/msuarc,https://www.facebook.com/W8MSU/,https://twitter.com/W8MSU,
a7f035fb-e79c-432e-9b45-e656cafca49c,Armenian Students' Association,msuasa,https://msu.campuslabs.com/engage/organization/msuasa,Contact Information Address Contact Email E: msuarmenians@gmail.com,msuarmenians@gmail.com,msuarmenians@gmail.com,,,,,"{""instagram"": ""https://www.instagram.com/msuarmenianclub/"", ""facebook"": null, ""twitter"": null, ""linkedin"": null, ""website"": ""https://msu.campuslabs.com/engage/organization/msuasa/contact""}",https://msu.campuslabs.com/engage/organization/msuasa/contact,https://www.instagram.com/msuarmenianclub/,,,
1587d652-a36c-4240-95f5-01428a088d1e,"Animal Welfare Club, MSU",msuawc,https://msu.campuslabs.com/engage/organization/msuawc,"The purposes of this organization shall be educating and serving our peers and community, and providing students with networking, service, and research opportunities in the fields of animal welfare and applied ethology. MSU AWC shall focus these efforts on understanding and improving an animal's quality of life using peer-reviewed scientific research, the three elements of animal welfare as described by the Farm Animal Welfare Education Centre, and the Five Freedoms as described by the Farm Animal Welfare Council. MSU AWCʻs ultimate mission is to build a community dedicated to improving animal welfare and supporting humane animal use through education and outreach. Contact Information Address 4642 S Hagadorn Rd East Lansing, MI 48823 United States of America Contact Email E: msuawc@gmail.com Phone Number P: 5867192297",msuawc@gmail.com,msuawc@gmail.com,5867192297,,,,"{""instagram"": ""https://www.instagram.com/msuawc?igshid=YmMyMTA2M2Y\\="", ""facebook"": null, ""twitter"": null, ""linkedin"": null, ""website"": ""https://sites.google.com/msu.edu/msuawc/home""}",https://sites.google.com/msu.edu/msuawc/home,https://www.instagram.com/msuawc?igshid=YmMyMTA2M2Y\=,,,
71fc1eff-6241-4410-8c4d-e45bb75598bc,Association for Women in Sports Media at Michigan State University,msuawsm,https://msu.campuslabs.com/engage/organization/msuawsm,"AWSM @ MSU is open to all students, regardless of gender identity and area of study. Our purpose is to support women in the sports media industry, both on and off campus. We prepare our members for success by hosting regular meetings that feature guest speakers, informational workshops and bonding opportunities with one another. Contact Information Address 404 Wilson Rd East Lansing, MI 48823 USA Contact Email E: awsm.michiganstate1855@gmail.com",awsm.michiganstate1855@gmail.com,awsm.michiganstate1855@gmail.com,,,,,"{""instagram"": ""https://www.instagram.com/msu_awsm/"", ""facebook"": ""https://www.facebook.com/AWSMatMichiganState/"", ""twitter"": ""https://twitter.com/msu_awsm"", ""linkedin"": ""https://www.linkedin.com/company/michigan-state-chapter-of-the-association-for-women-in-sports-media/?viewAsMember=true"", ""website"": ""https://awsmmichiganstate.weebly.com/""}",https://awsmmichiganstate.weebly.com/,https://www.instagram.com/msu_awsm/,https://www.facebook.com/AWSMatMichiganState/,https://twitter.com/msu_awsm,https://www.linkedin.com/company/michigan-state-chapter-of-the-association-for-women-in-sports-media/?viewAsMember=true
81697db7-5c6e-4087-a278-19c36942499c,Black Alumni Student Scholarship Group,msuba,https://msu.campuslabs.com/engage/organization/msuba,Contact Information Address Contact Email E: Scholarship@msuba.org,Scholarship@msuba.org,Scholarship@msuba.org,2023-2024,,,,"{""instagram"": null, ""facebook"": null, ""twitter"": null, ""linkedin"": null, ""website"": ""https://msu.campuslabs.com/engage/organization/msuba/contact""}",https://msu.campuslabs.com/engage/organization/msuba/contact,,,,
4bf55cf1-0dea-4688-a4f9-9a94cae3c313,"Ballet, MSU",msuballet,https://msu.campuslabs.com/engage/organization/msuballet,"The MSU Ballet Club is a relaxed club that wants to support group fitness! We have classes for all levels of dancers or non-dancers, from ballet and jazz to yoga and conditioning. We also put together a performance each semester for students who wish to perform or showcase their choreography. We have no fees, auditions, or dress codes! All MSU undergraduate and graduate students are welcome! Please check out our selection of classes on our website! Contact Information Address Contact Email E: rso.balletatmsu@msu.edu",rso.balletatmsu@msu.edu,rso.balletatmsu@msu.edu,,,,,"{""instagram"": ""https://www.instagram.com/msu.ballet/"", ""facebook"": null, ""twitter"": null, ""linkedin"": null, ""website"": ""https://balletatmsu.wixsite.com/msu-ballet""}",https://balletatmsu.wixsite.com/msu-ballet,https://www.instagram.com/msu.ballet/,,,
ef198ecb-c7bd-4e50-aeed-a93b95ab1d63,"Ballroom Dance Team, MSU",msubdt,https://msu.campuslabs.com/engage/organization/msubdt,"See our YouTube channel Main objective: To facilitate a culture of competitive ballroom dancers. -The MSU Ballroom Dance Team will provide ongoing and extensive knowledge of Ballroom and Latin dance to enable dancers to achieve a competitive level of proficiency that is reinforced through competition. -MSUBDT will provide all members with the necessary tools and resources to compete at various amateur and collegiate competitions, throughout the Midwest, at varying levels of difficulty, throughout the academic year. These competitions are to showcase advancement in skill, performance ability, the bond between two dance partners, and to create an overall image of this team. -MSUBDT strives to bring students and community members together to experience the growing sport of ballroom dance in a positive, social, interactive environment through continued community interaction and support. -MSUBDT will work to better the communities around MSU, as well as the campus of MSU, by providing a service, volunteering, and bringing community members and students together to better understand one another through the art of dance. Contact Information Address Contact Email E: ballroom@msu.edu",ballroom@msu.edu,ballroom@msu.edu,,,,,"{""instagram"": ""https://instagram.com/msuballroom?igshid=erni33ojhf12"", ""facebook"": ""https://www.facebook.com/groups/187513984610759/?ref=share"", ""twitter"": null, ""linkedin"": null, ""website"": ""https://msuballroomdancete.wixsite.com/msuballroom/""}",https://msuballroomdancete.wixsite.com/msuballroom/,https://instagram.com/msuballroom?igshid=erni33ojhf12,https://www.facebook.com/groups/187513984610759/?ref=share,,
fd89706e-df8a-4f5a-8809-d67694604b9f,Alpha Phi Omega,msubetabeta,https://msu.campuslabs.com/engage/organization/msubetabeta,"Alpha Phi Omega is a gender inclusive non-greek nationally recognized community service fraternity. We offer many service events throughout the week, as well as social events where you can get to know other people in the fraternity. We meet every Sunday at 6:30pm in the Business College. We welcome all students, feel free to stop by! http://www.msubetabeta.com Contact Information Address Contact Email E: apo@msu.edu",apo@msu.edu,apo@msu.edu,,,,,"{""instagram"": ""https://www.instagram.com/apo_betabeta/"", ""facebook"": ""https://www.facebook.com/groups/171244176324302"", ""twitter"": null, ""linkedin"": ""https://www.linkedin.com/groups/14423431/"", ""website"": ""http://www.msubetabeta.com""}",http://www.msubetabeta.com,https://www.instagram.com/apo_betabeta/,https://www.facebook.com/groups/171244176324302,,https://www.linkedin.com/groups/14423431/
